[
  {
    "battery_id": "canon_bp_511",
    "brand": "Canon",
    "model": "BP-511",
    "aliases": [],
    "chemistry": "lithium-ion",
    "voltage": null,
    "capacity_mah": null,
    "notes": "Added from Canon Batch 1 import; electrical details left blank unless separately source-backed."
  },
  {
    "battery_id": "canon_bp_511a",
    "brand": "Canon",
    "model": "BP-511A",
    "aliases": [],
    "chemistry": "lithium-ion",
    "voltage": null,
    "capacity_mah": null,
    "notes": "Added from Canon Batch 1 import; electrical details left blank unless separately source-backed."
  },
  {
    "battery_id": "canon_bp_512",
    "brand": "Canon",
    "model": "BP-512",
    "aliases": [],
    "chemistry": "lithium-ion",
    "voltage": null,
    "capacity_mah": null,
    "notes": "Added from Canon Batch 1 import; electrical details left blank unless separately source-backed."
  },
  {
    "battery_id": "canon_nb_10l",
    "brand": "Canon",
    "model": "NB-10L",
    "aliases": [],
    "chemistry": "lithium-ion",
    "voltage": null,
    "capacity_mah": null,
    "notes": "Added from Canon Batch 1 import; electrical details left blank unless separately source-backed."
  },
  {
    "battery_id": "canon_nb_11l",
    "brand": "Canon",
    "model": "NB-11L",
    "aliases": [],
    "chemistry": "lithium-ion",
    "voltage": null,
    "capacity_mah": null,
    "notes": "Added from Canon Batch 1 import; electrical details left blank unless separately source-backed."
  },
  {
    "battery_id": "canon_nb_11lh",
    "brand": "Canon",
    "model": "NB-11LH",
    "aliases": [],
    "chemistry": "lithium-ion",
    "voltage": null,
    "capacity_mah": null,
    "notes": "Added from Canon Batch 1 import; electrical details left blank unless separately source-backed."
  },
  {
    "battery_id": "canon_nb_12l",
    "brand": "Canon",
    "model": "NB-12L",
    "aliases": [],
    "chemistry": "lithium-ion",
    "voltage": null,
    "capacity_mah": null,
    "notes": ""
  },
  {
    "battery_id": "canon_nb_13l",
    "brand": "Canon",
    "model": "NB-13L",
    "aliases": [],
    "chemistry": "lithium-ion",
    "voltage": 3.6,
    "capacity_mah": 1250,
    "notes": "Canon Japan FAQ lists nominal voltage 3.6 V and nominal capacity 1250 mAh."
  },
  {
    "battery_id": "canon_nb_15l",
    "brand": "Canon",
    "model": "NB-15L",
    "aliases": [],
    "chemistry": "lithium-ion",
    "voltage": null,
    "capacity_mah": null,
    "notes": "Added from Canon Batch 1 import; electrical details left blank unless separately source-backed."
  },
  {
    "battery_id": "canon_nb_1ah",
    "brand": "Canon",
    "model": "NB-1AH",
    "aliases": [],
    "chemistry": "lithium-ion",
    "voltage": null,
    "capacity_mah": null,
    "notes": "Added from Canon Batch 1 import; electrical details left blank unless separately source-backed."
  },
  {
    "battery_id": "canon_nb_1l",
    "brand": "Canon",
    "model": "NB-1L",
    "aliases": [],
    "chemistry": "lithium-ion",
    "voltage": null,
    "capacity_mah": null,
    "notes": ""
  },
  {
    "battery_id": "canon_nb_1lh",
    "brand": "Canon",
    "model": "NB-1LH",
    "aliases": [],
    "chemistry": "lithium-ion",
    "voltage": null,
    "capacity_mah": null,
    "notes": "Added from Canon Batch 1 import; electrical details left blank unless separately source-backed."
  },
  {
    "battery_id": "canon_nb_2ah",
    "brand": "Canon",
    "model": "NB-2AH",
    "aliases": [],
    "chemistry": "lithium-ion",
    "voltage": null,
    "capacity_mah": null,
    "notes": "Added from Canon Batch 1 import; electrical details left blank unless separately source-backed."
  },
  {
    "battery_id": "canon_nb_2l",
    "brand": "Canon",
    "model": "NB-2L",
    "aliases": [],
    "chemistry": "lithium-ion",
    "voltage": null,
    "capacity_mah": null,
    "notes": "Added from Canon Batch 1 import; electrical details left blank unless separately source-backed."
  },
  {
    "battery_id": "canon_nb_2lh",
    "brand": "Canon",
    "model": "NB-2LH",
    "aliases": [],
    "chemistry": "lithium-ion",
    "voltage": null,
    "capacity_mah": null,
    "notes": "Added from Canon Batch 1 import; electrical details left blank unless separately source-backed."
  },
  {
    "battery_id": "canon_nb_300",
    "brand": "Canon",
    "model": "NB-300",
    "aliases": [],
    "chemistry": "lithium-ion",
    "voltage": null,
    "capacity_mah": null,
    "notes": "Added from Canon Batch 1 import; electrical details left blank unless separately source-backed."
  },
  {
    "battery_id": "canon_nb_3ah",
    "brand": "Canon",
    "model": "NB-3AH",
    "aliases": [],
    "chemistry": "lithium-ion",
    "voltage": null,
    "capacity_mah": null,
    "notes": "Added from Canon Batch 1 import; electrical details left blank unless separately source-backed."
  },
  {
    "battery_id": "canon_nb_3l",
    "brand": "Canon",
    "model": "NB-3L",
    "aliases": [],
    "chemistry": "lithium-ion",
    "voltage": null,
    "capacity_mah": null,
    "notes": "Added from Canon Batch 1 import; electrical details left blank unless separately source-backed."
  },
  {
    "battery_id": "canon_nb_4l",
    "brand": "Canon",
    "model": "NB-4L",
    "aliases": [],
    "chemistry": "lithium-ion",
    "voltage": null,
    "capacity_mah": null,
    "notes": "Added from Canon Batch 1 import; electrical details left blank unless separately source-backed."
  },
  {
    "battery_id": "canon_nb_5l",
    "brand": "Canon",
    "model": "NB-5L",
    "aliases": [],
    "chemistry": "lithium-ion",
    "voltage": null,
    "capacity_mah": null,
    "notes": "Added from Canon Batch 1 import; electrical details left blank unless separately source-backed."
  },
  {
    "battery_id": "canon_nb_6l",
    "brand": "Canon",
    "model": "NB-6L",
    "aliases": [],
    "chemistry": "lithium-ion",
    "voltage": null,
    "capacity_mah": null,
    "notes": "Added from Canon Batch 1 import; electrical details left blank unless separately source-backed."
  },
  {
    "battery_id": "canon_nb_6lh",
    "brand": "Canon",
    "model": "NB-6LH",
    "aliases": [],
    "chemistry": "lithium-ion",
    "voltage": null,
    "capacity_mah": null,
    "notes": "Added from Canon Batch 1 import; electrical details left blank unless separately source-backed."
  },
  {
    "battery_id": "canon_nb_7l",
    "brand": "Canon",
    "model": "NB-7L",
    "aliases": [],
    "chemistry": "lithium-ion",
    "voltage": null,
    "capacity_mah": null,
    "notes": "Added from Canon Batch 1 import; electrical details left blank unless separately source-backed."
  },
  {
    "battery_id": "canon_nb_8l",
    "brand": "Canon",
    "model": "NB-8L",
    "aliases": [],
    "chemistry": "lithium-ion",
    "voltage": null,
    "capacity_mah": null,
    "notes": "Added from Canon Batch 1 import; electrical details left blank unless separately source-backed."
  },
  {
    "battery_id": "canon_nb_9l",
    "brand": "Canon",
    "model": "NB-9L",
    "aliases": [],
    "chemistry": "lithium-ion",
    "voltage": null,
    "capacity_mah": null,
    "notes": "Added from Canon Batch 1 import; electrical details left blank unless separately source-backed."
  },
  {
    "battery_id": "casio_np_110",
    "brand": "Casio",
    "model": "NP-110",
    "aliases": [],
    "chemistry": "lithium-ion",
    "voltage": null,
    "capacity_mah": null,
    "notes": "Added by web-assisted verifier from an explicit source-backed battery mapping."
  },
  {
    "battery_id": "casio_np_130",
    "brand": "Casio",
    "model": "NP-130",
    "aliases": [],
    "chemistry": "lithium-ion",
    "voltage": null,
    "capacity_mah": 1800,
    "notes": "Casio FAQ lists rated capacity 1800 mAh."
  },
  {
    "battery_id": "casio_np_130a",
    "brand": "Casio",
    "model": "NP-130A",
    "aliases": [],
    "chemistry": "lithium-ion",
    "voltage": null,
    "capacity_mah": 1800,
    "notes": "Casio FAQ lists rated capacity 1800 mAh."
  },
  {
    "battery_id": "fujifilm_np_120",
    "brand": "Fujifilm",
    "model": "NP-120",
    "aliases": [],
    "chemistry": "lithium-ion",
    "voltage": null,
    "capacity_mah": null,
    "notes": "Added by Phase 3 unresolved verifier; electrical details left blank unless source-backed."
  },
  {
    "battery_id": "fujifilm_np_140",
    "brand": "Fujifilm",
    "model": "NP-140",
    "aliases": [],
    "chemistry": "lithium-ion",
    "voltage": null,
    "capacity_mah": null,
    "notes": "Added by web-assisted verifier from an explicit source-backed battery mapping."
  },
  {
    "battery_id": "fujifilm_np_40",
    "brand": "Fujifilm",
    "model": "NP-40",
    "aliases": [],
    "chemistry": "lithium-ion",
    "voltage": null,
    "capacity_mah": null,
    "notes": "Added by Phase 3 unresolved verifier; electrical details left blank unless source-backed."
  },
  {
    "battery_id": "fujifilm_np_45s",
    "brand": "Fujifilm",
    "model": "NP-45S",
    "aliases": [],
    "chemistry": "lithium-ion",
    "voltage": null,
    "capacity_mah": null,
    "notes": "Added by web-assisted verifier from an explicit source-backed battery mapping."
  },
  {
    "battery_id": "fujifilm_np_50",
    "brand": "Fujifilm",
    "model": "NP-50",
    "aliases": [],
    "chemistry": "lithium-ion",
    "voltage": 3.6,
    "capacity_mah": null,
    "notes": "Voltage confirmed in FinePix REAL 3D W3 manual snippet."
  },
  {
    "battery_id": "fujifilm_np_70",
    "brand": "Fujifilm",
    "model": "NP-70",
    "aliases": [],
    "chemistry": "lithium-ion",
    "voltage": null,
    "capacity_mah": null,
    "notes": "Added by Phase 3 unresolved verifier; electrical details left blank unless source-backed."
  },
  {
    "battery_id": "fujifilm_np_95",
    "brand": "Fujifilm",
    "model": "NP-95",
    "aliases": [],
    "chemistry": "lithium-ion",
    "voltage": null,
    "capacity_mah": null,
    "notes": "Added by import_all_remaining.py; electrical details left blank unless source-backed."
  },
  {